<?xml version="1.0" encoding="UTF-8"?>
<list xmlns:xsi="http://www.w3.org/2001/XMLSchema-instance" xsi:noNamespaceSchemaLocation="../../xsd/items.xsd">
	<item id="5200" name="Chest Key - Grade 5" additionalName="Not Available" type="EtcItem">
		<!-- The item is not available. Opens a level 30 treasure chest with a success rate of 60%. When opening a higher level treasure chest, the success rate will decrease. -->
		<set name="icon" val="icon.etc_ertheia2" />
		<set name="default_action" val="SKILL_REDUCE" />
		<set name="material" val="LIQUID" />
		<set name="weight" val="10" />
		<set name="price" val="1900" />
		<set name="is_stackable" val="true" />
		<set name="is_oly_restricted" val="true" />
		<set name="handler" val="ItemSkills" />
		<set name="commissionItemType" val="OTHER_ITEM" />
		<skills>
			<skill id="2065" level="4" /> <!-- Box Key -->
		</skills>
	</item>
	<item id="5201" name="Chest Key - Grade 4" additionalName="Not Available" type="EtcItem">
		<!-- The item is not available. Opens a level 40 treasure chest with a success rate of 60%. When opening a higher level treasure chest, the success rate will decrease. -->
		<set name="icon" val="icon.etc_ertheia2" />
		<set name="default_action" val="SKILL_REDUCE" />
		<set name="material" val="LIQUID" />
		<set name="weight" val="10" />
		<set name="price" val="3200" />
		<set name="is_stackable" val="true" />
		<set name="is_oly_restricted" val="true" />
		<set name="handler" val="ItemSkills" />
		<set name="commissionItemType" val="OTHER_ITEM" />
		<skills>
			<skill id="2065" level="5" /> <!-- Box Key -->
		</skills>
	</item>
	<item id="5202" name="Chest Key - Grade 3" additionalName="Not Available" type="EtcItem">
		<!-- The item is not available. Opens a level 50 treasure chest with a success rate of 60%. When opening a higher level treasure chest, the success rate will decrease. -->
		<set name="icon" val="icon.etc_ertheia2" />
		<set name="default_action" val="SKILL_REDUCE" />
		<set name="material" val="LIQUID" />
		<set name="weight" val="10" />
		<set name="price" val="5100" />
		<set name="is_stackable" val="true" />
		<set name="is_oly_restricted" val="true" />
		<set name="handler" val="ItemSkills" />
		<set name="commissionItemType" val="OTHER_ITEM" />
		<skills>
			<skill id="2065" level="6" /> <!-- Box Key -->
		</skills>
	</item>
	<item id="5203" name="Chest Key - Grade 2" additionalName="Not Available" type="EtcItem">
		<!-- The item is not available. Opens a level 60 treasure chest with a success rate of 60%. When opening a higher level treasure chest, the success rate will decrease. -->
		<set name="icon" val="icon.etc_ertheia2" />
		<set name="default_action" val="SKILL_REDUCE" />
		<set name="material" val="LIQUID" />
		<set name="weight" val="10" />
		<set name="price" val="7400" />
		<set name="is_stackable" val="true" />
		<set name="is_oly_restricted" val="true" />
		<set name="handler" val="ItemSkills" />
		<set name="commissionItemType" val="OTHER_ITEM" />
		<skills>
			<skill id="2065" level="7" /> <!-- Box Key -->
		</skills>
	</item>
	<item id="5204" name="Chest Key - Grade 1" additionalName="Not Available" type="EtcItem">
		<!-- The item is not available. Opens a level 70 treasure chest with a success rate of 60%. When opening a higher level treasure chest, the success rate will decrease. -->
		<set name="icon" val="icon.etc_ertheia2" />
		<set name="default_action" val="SKILL_REDUCE" />
		<set name="material" val="LIQUID" />
		<set name="weight" val="10" />
		<set name="price" val="10000" />
		<set name="is_stackable" val="true" />
		<set name="is_oly_restricted" val="true" />
		<set name="handler" val="ItemSkills" />
		<set name="commissionItemType" val="OTHER_ITEM" />
		<skills>
			<skill id="2065" level="8" /> <!-- Box Key -->
		</skills>
	</item>
	<item id="5205" name="Mercenary Posting Ticket (Sword/Stationary)" additionalName="Not Available" type="EtcItem">
		<!-- The item is not available. Innadril/Sword/Stationary. -->
		<set name="icon" val="icon.etc_ertheia2" />
		<set name="etcitem_type" val="CASTLE_GUARD" />
		<set name="immediate_effect" val="true" />
		<set name="material" val="PAPER" />
		<set name="price" val="50000" />
		<set name="is_stackable" val="true" />
		<set name="commissionItemType" val="OTHER_ITEM" />
		<set name="handler" val="MercTicket" />
	</item>
	<item id="5206" name="Mercenary Posting Ticket (Spear/Stationary)" additionalName="Not Available" type="EtcItem">
		<!-- The item is not available. Innadril/Spear/Stationary. -->
		<set name="icon" val="icon.etc_ertheia2" />
		<set name="etcitem_type" val="CASTLE_GUARD" />
		<set name="immediate_effect" val="true" />
		<set name="material" val="PAPER" />
		<set name="price" val="60000" />
		<set name="is_stackable" val="true" />
		<set name="commissionItemType" val="OTHER_ITEM" />
		<set name="handler" val="MercTicket" />
	</item>
	<item id="5207" name="Mercenary Posting Ticket (Bow/Stationary)" additionalName="Not Available" type="EtcItem">
		<!-- The item is not available. Innadril/Bow/Stationary. -->
		<set name="icon" val="icon.etc_ertheia2" />
		<set name="etcitem_type" val="CASTLE_GUARD" />
		<set name="immediate_effect" val="true" />
		<set name="material" val="PAPER" />
		<set name="price" val="70000" />
		<set name="is_stackable" val="true" />
		<set name="commissionItemType" val="OTHER_ITEM" />
		<set name="handler" val="MercTicket" />
	</item>
	<item id="5208" name="Mercenary Posting Ticket (Cleric/Stationary)" additionalName="Not Available" type="EtcItem">
		<!-- The item is not available. Innadril/ Healer/ Stationary. -->
		<set name="icon" val="icon.etc_ertheia2" />
		<set name="etcitem_type" val="CASTLE_GUARD" />
		<set name="immediate_effect" val="true" />
		<set name="material" val="PAPER" />
		<set name="price" val="170000" />
		<set name="is_stackable" val="true" />
		<set name="commissionItemType" val="OTHER_ITEM" />
		<set name="handler" val="MercTicket" />
	</item>
	<item id="5209" name="Mercenary Posting Ticket (Wizard/Stationary)" additionalName="Not Available" type="EtcItem">
		<!-- The item is not available. Innadril/Wizard/Stationary -->
		<set name="icon" val="icon.etc_ertheia2" />
		<set name="etcitem_type" val="CASTLE_GUARD" />
		<set name="immediate_effect" val="true" />
		<set name="material" val="PAPER" />
		<set name="price" val="170000" />
		<set name="is_stackable" val="true" />
		<set name="commissionItemType" val="OTHER_ITEM" />
		<set name="handler" val="MercTicket" />
	</item>
	<item id="5210" name="Mercenary Posting Ticket (Sword/ Mobile)" additionalName="Not Available" type="EtcItem">
		<!-- The item is not available. Innadril/ Sword/ Mobile. -->
		<set name="icon" val="icon.etc_ertheia2" />
		<set name="etcitem_type" val="CASTLE_GUARD" />
		<set name="immediate_effect" val="true" />
		<set name="material" val="PAPER" />
		<set name="price" val="50000" />
		<set name="is_stackable" val="true" />
		<set name="commissionItemType" val="OTHER_ITEM" />
		<set name="handler" val="MercTicket" />
	</item>
	<item id="5211" name="Mercenary Posting Ticket (Spear/ Mobile)" additionalName="Not Available" type="EtcItem">
		<!-- The item is not available. Innadril/ Spear/ Mobile. -->
		<set name="icon" val="icon.etc_ertheia2" />
		<set name="etcitem_type" val="CASTLE_GUARD" />
		<set name="immediate_effect" val="true" />
		<set name="material" val="PAPER" />
		<set name="price" val="60000" />
		<set name="is_stackable" val="true" />
		<set name="commissionItemType" val="OTHER_ITEM" />
		<set name="handler" val="MercTicket" />
	</item>
	<item id="5212" name="Mercenary Posting Ticket (Bow/ Mobile)" additionalName="Not Available" type="EtcItem">
		<!-- The item is not available. Innadril/ Bow/ Mobile. -->
		<set name="icon" val="icon.etc_ertheia2" />
		<set name="etcitem_type" val="CASTLE_GUARD" />
		<set name="immediate_effect" val="true" />
		<set name="material" val="PAPER" />
		<set name="price" val="70000" />
		<set name="is_stackable" val="true" />
		<set name="commissionItemType" val="OTHER_ITEM" />
		<set name="handler" val="MercTicket" />
	</item>
	<item id="5213" name="Mercenary Posting Ticket (Cleric/ Mobile)" additionalName="Not Available" type="EtcItem">
		<!-- The item is not available. Innadril/ Healer/ Mobile. -->
		<set name="icon" val="icon.etc_ertheia2" />
		<set name="etcitem_type" val="CASTLE_GUARD" />
		<set name="immediate_effect" val="true" />
		<set name="material" val="PAPER" />
		<set name="price" val="170000" />
		<set name="is_stackable" val="true" />
		<set name="commissionItemType" val="OTHER_ITEM" />
		<set name="handler" val="MercTicket" />
	</item>
	<item id="5214" name="Mercenary Posting Ticket (Wizard/Mobile)" additionalName="Not Available" type="EtcItem">
		<!-- The item is not available. Innadril/Wizard/Mobile -->
		<set name="icon" val="icon.etc_ertheia2" />
		<set name="etcitem_type" val="CASTLE_GUARD" />
		<set name="immediate_effect" val="true" />
		<set name="material" val="PAPER" />
		<set name="price" val="170000" />
		<set name="is_stackable" val="true" />
		<set name="commissionItemType" val="OTHER_ITEM" />
		<set name="handler" val="MercTicket" />
	</item>
	<item id="5215" name="Mercenary Posting Ticket (Teleporter1)" additionalName="Not Available" type="EtcItem">
		<!-- The item is not available. Innadril/Teleporter/Inner Castle, Guard -->
		<set name="icon" val="icon.etc_ertheia2" />
		<set name="etcitem_type" val="CASTLE_GUARD" />
		<set name="immediate_effect" val="true" />
		<set name="material" val="PAPER" />
		<set name="price" val="100000" />
		<set name="is_stackable" val="true" />
		<set name="commissionItemType" val="OTHER_ITEM" />
		<set name="handler" val="MercTicket" />
	</item>
	<item id="5218" name="Mercenary Posting Ticket (Teleporter2)" additionalName="Not Available" type="EtcItem">
		<!-- The item is not available. Innadril/Teleporter/Outer Castle, Guardian -->
		<set name="icon" val="icon.etc_ertheia2" />